{
  "$schema": "https://json-schema.org/draft/2020-12/schema",
  "$id": "https://memphis-zoo.example/custodial/v4.3/phase1/build-contract-v2",
  "type": "object",
  "additionalProperties": false,
  "required": ["protocol","revision","phase","status","source_tuple","authority","canonical_artifacts","invariants","validation","rollback"],
  "properties": {
    "protocol": {"const":"CUSTODIAL_V43_ARCHITECTURE_FOUNDATION_BUILD_CONTRACT_V2"},
    "revision": {"const":"v4.3.2"},
    "phase": {"const":"PHASE_1_FOUNDATION"},
    "status": {"const":"DRAFT_REMOTE_PHASE_1"},
    "source_tuple": {
      "type":"object","additionalProperties":false,
      "required":["repository","governance_branch","governance_commit","phase1_branch","phase1_commit","correction_branch","bootstrap_commit"],
      "properties":{
        "repository":{"const":"lasrevinu333-design/Engine"},
        "governance_branch":{"type":"string","minLength":1},
        "governance_commit":{"type":"string","pattern":"^[0-9a-f]{40}$"},
        "phase1_branch":{"type":"string","minLength":1},
        "phase1_commit":{"const":"f8235b88ef178da50681789a5ebff0dbcf4df5f2"},
        "correction_branch":{"const":"agent/custodial-v43-remote-foundation-phase1-correction-20260806"},
        "bootstrap_commit":{"const":"58159ef9e5440d9f654f381c4eee2a875d298ee6"}
      }
    },
    "authority": {
      "type":"object","additionalProperties":false,
      "required":["phase1_draft","architecture_approved","phase2_authorized","schema_design_authorized","component_design_authorized","implementation_authorized","migration_authorized","apk_authorized","device_authorized","canary_authorized","fleet_authorized","release_authorized","production_authorized"],
      "properties":{
        "phase1_draft":{"const":true},
        "architecture_approved":{"const":false},
        "phase2_authorized":{"const":false},
        "schema_design_authorized":{"const":false},
        "component_design_authorized":{"const":false},
        "implementation_authorized":{"const":false},
        "migration_authorized":{"const":false},
        "apk_authorized":{"const":false},
        "device_authorized":{"const":false},
        "canary_authorized":{"const":false},
        "fleet_authorized":{"const":false},
        "release_authorized":{"const":false},
        "production_authorized":{"const":false}
      }
    },
    "canonical_artifacts":{"type":"array","minItems":12,"uniqueItems":true,"items":{"type":"string","minLength":1}},
    "invariants":{"type":"array","minItems":14,"uniqueItems":true,"items":{"type":"object","additionalProperties":false,"required":["id","rule"],"properties":{"id":{"pattern":"^AF2-I[0-9]{2}$"},"rule":{"type":"string","minLength":1}}}},
    "validation":{"type":"object","additionalProperties":false,"required":["runtime","dependencies","entrypoint","workflow","receipt","failure_mode"],"properties":{"runtime":{"const":"node-22.23.1"},"dependencies":{"type":"array","maxItems":0},"entrypoint":{"type":"string","minLength":1},"workflow":{"type":"string","minLength":1},"receipt":{"type":"string","minLength":1},"failure_mode":{"const":"fail_closed"}}},
    "rollback":{"type":"object","additionalProperties":false,"required":["required","runtime_state_created","preserve","strategy"],"properties":{"required":{"const":true},"runtime_state_created":{"const":false},"preserve":{"type":"array","minItems":3,"uniqueItems":true,"items":{"type":"string","minLength":1}},"strategy":{"type":"string","minLength":1}}}
  }
}
