{
  "protocol": "CUSTODIAL_V43_ARCHITECTURE_FOUNDATION_BUILD_CONTRACT_V2",
  "revision": "v4.3.2",
  "phase": "PHASE_1_FOUNDATION",
  "status": "DRAFT_REMOTE_PHASE_1",
  "source_tuple": {
    "repository": "lasrevinu333-design/Engine",
    "governance_branch": "audit/custodial-unified-v4-3-2-h05-final-freeze-20260806",
    "governance_commit": "569dc25c11723801a212de489dced7da776d5be7",
    "phase1_branch": "agent/custodial-v43-standalone-architecture-remote-20260806",
    "phase1_commit": "f8235b88ef178da50681789a5ebff0dbcf4df5f2",
    "correction_branch": "agent/custodial-v43-remote-foundation-phase1-correction-20260806",
    "bootstrap_commit": "58159ef9e5440d9f654f381c4eee2a875d298ee6"
  },
  "authority": {
    "phase1_draft": true,
    "architecture_approved": false,
    "phase2_authorized": false,
    "schema_design_authorized": false,
    "component_design_authorized": false,
    "implementation_authorized": false,
    "migration_authorized": false,
    "apk_authorized": false,
    "device_authorized": false,
    "canary_authorized": false,
    "fleet_authorized": false,
    "release_authorized": false,
    "production_authorized": false
  },
  "canonical_artifacts": [
    "architecture-foundation-build-contract.json",
    "architecture-foundation-build-contract.schema.json",
    "foundation-artifact-schemas.json",
    "phase1-foundation-registry.json",
    "artifact-generation-dag.json",
    "architecture-foundation-manifest.json",
    "phase1-stage-decision.json",
    "phase1-foundation-contract.md",
    "schema-coverage-ledger.json",
    "proof-obligation-catalog.json",
    "fixtures/negative-fixtures.json",
    "validate-architecture-foundation.mjs"
  ],
  "invariants": [
    {"id":"AF2-I01","rule":"source_tuple is immutable and exact"},
    {"id":"AF2-I02","rule":"all JSON schema object nodes reject additional properties"},
    {"id":"AF2-I03","rule":"every normative object and planned Phase-2 identity is registered"},
    {"id":"AF2-I04","rule":"unknown record types and versions fail closed"},
    {"id":"AF2-I05","rule":"authorization defaults deny and public read cannot reach privileged planes"},
    {"id":"AF2-I06","rule":"ordinary runtime principals cannot migrate, release, administer, or own databases"},
    {"id":"AF2-I07","rule":"authority-set activation is fenced, transactional, and acyclic"},
    {"id":"AF2-I08","rule":"the artifact DAG is acyclic and every field has exactly one owner"},
    {"id":"AF2-I09","rule":"content identity excludes its own digest, containing commit, lifecycle state, receipts, and stage decisions"},
    {"id":"AF2-I10","rule":"stage authority is append-only and external to immutable content identity"},
    {"id":"AF2-I11","rule":"unknown writers and control surfaces are registered research blockers"},
    {"id":"AF2-I12","rule":"every gate and proof obligation has an owner, evidence, failure behavior, and earliest blocked stage"},
    {"id":"AF2-I13","rule":"all negative fixtures fail with exact stable error codes"},
    {"id":"AF2-I14","rule":"validation never authorizes Phase 2 or downstream work"}
  ],
  "validation": {
    "runtime": "node-22.23.1",
    "dependencies": [],
    "entrypoint": "docs/audits/custodial-unified-v4-3-architecture/validate-architecture-foundation.mjs",
    "workflow": ".github/workflows/custodial-v43-architecture-foundation.yml",
    "receipt": "docs/audits/custodial-unified-v4-3-architecture/validation-result.json",
    "failure_mode": "fail_closed"
  },
  "rollback": {
    "required": true,
    "runtime_state_created": false,
    "preserve": [
      "f8235b88ef178da50681789a5ebff0dbcf4df5f2",
      "58159ef9e5440d9f654f381c4eee2a875d298ee6",
      "pull/131"
    ],
    "strategy": "keep PR 131 draft and abandon the correction head as authority"
  }
}
